{"bundle_bytes_max":524288,"bundle_file_limit":18,"cancellation_bytes_max":8192,"channel_bootstrap_policy":"owned-channel-layout-v1","consumption_bytes_max":8192,"initializer_id":"deeptwin-provider-source-init-v1","layout_id":"provider-source-bundle-v1","original_prepare_recipe":{"path":"deploy/security/deployment-prepare-recipe-v1.json","sha256":"03490ee7c676a0c78915fdef3ec48c52d6b88838ad71bce001ad2fe72f5e67b7","size_bytes":606},"original_receipt_recipe":{"path":"deploy/security/deployment-receipt-recipe-v1.json","sha256":"3417fbc488ab745019b909564282cc9ff971c99fa2d5ba592e4faeb2f742e173","size_bytes":487},"receipt_bytes_max":16384,"recipe_id":"private-provider-source-channels-v1","renderer_id":"deeptwin-provider-source-expand-v1","request_bytes_max":65536,"schema_version":"deployment-provider-source-recipe-v1","worker_profile":"claude-text-transform-v1"}